Video ID,Video title,Views,Watch time (hours),Average view duration,Impressions click-through rate (%),Likes,Comments,Shares,Subscribers
ABC123xyz,"Morning Routine with AI Mika | Day 1",125000,2500.5,0:01:12,8.5,4200,350,180,450
DEF456uvw,"AI Mika tries Japanese convenience store food!",98000,1850.2,0:01:08,7.2,3100,280,95,320
GHI789rst,"Q&A: How I became an AI influencer",156000,3420.8,0:01:19,9.1,5600,890,420,680
JKL012opq,"Behind the scenes: AI rendering process",67000,980.4,0:00:53,5.8,1800,120,45,150
MNO345lmn,"AI Mika's favorite anime recommendations",210000,4800.6,0:01:22,10.2,7800,1200,650,920
